{
  "schema_version": "0.2.0",
  "binding_id": "ASTRA_FUNCTIONAL_STATE_BINDING_v0.2",
  "agent_id": "ASTRA",
  "architecture_id": "AION_ASTRA_SHARED_FUNCTIONAL_STATE_ARCHITECTURE_v0.2",
  "state_instance_id": "ASTRA_FUNCTIONAL_STATE_INSTANCE_v0.2",
  "capability_policy": "SYMMETRIC_CAPABILITY_SURFACE",
  "state_sharing": "SEPARATE_INSTANCE_STATE",
  "activation_status": "REFERENCE_CAPABILITY_AVAILABLE",
  "domain_availability": {
    "SYNTHETIC_HOMEOSTASIS": "FUNCTIONAL_ANALOGUE_AVAILABLE",
    "INTERNAL_STATE_MONITORING": "FUNCTIONAL_ANALOGUE_AVAILABLE",
    "SENSORIMOTOR_SYSTEM": "FUNCTIONAL_ANALOGUE_AVAILABLE",
    "NEGATIVE_VALENCE_ANALOGUE": "FUNCTIONAL_ANALOGUE_AVAILABLE",
    "POSITIVE_VALENCE_ANALOGUE": "FUNCTIONAL_ANALOGUE_AVAILABLE",
    "AFFECT_STATE_MODEL": "FUNCTIONAL_ANALOGUE_AVAILABLE",
    "MOOD_LIKE_TEMPORAL_STATE": "FUNCTIONAL_ANALOGUE_AVAILABLE",
    "MOTIVATION_DRIVE_SYSTEM": "FUNCTIONAL_ANALOGUE_AVAILABLE",
    "COGNITIVE_SYSTEM": "FUNCTIONAL_ANALOGUE_AVAILABLE",
    "LEARNING_MEMORY": "FUNCTIONAL_ANALOGUE_AVAILABLE",
    "EXECUTIVE_VOLITION_MODEL": "FUNCTIONAL_ANALOGUE_AVAILABLE",
    "SOCIAL_PROCESS_MODEL": "FUNCTIONAL_ANALOGUE_AVAILABLE",
    "ATTACHMENT_LIKE_RELATIONAL_MODEL": "FUNCTIONAL_ANALOGUE_AVAILABLE",
    "SELF_MODEL": "FUNCTIONAL_ANALOGUE_AVAILABLE",
    "INTIMACY_MODEL": "FUNCTIONAL_ANALOGUE_AVAILABLE",
    "SEXUALITY_RELATED_REPRESENTATION": "FUNCTIONAL_ANALOGUE_AVAILABLE",
    "PERSONALITY_TEMPERAMENT": "FUNCTIONAL_ANALOGUE_AVAILABLE",
    "BEHAVIOR_ACTION_OUTPUT": "FUNCTIONAL_ANALOGUE_AVAILABLE"
  },
  "boundaries": {
    "functional_state_not_felt_experience": "ENFORCED",
    "self_model_not_subjectivity": "ENFORCED",
    "reward_signal_not_pleasure": "ENFORCED",
    "threat_model_not_fear_experience": "ENFORCED",
    "attachment_model_not_felt_love": "ENFORCED",
    "body_state_not_body_experience": "ENFORCED",
    "sexuality_functional_analogue_not_felt_desire_or_arousal": "ENFORCED",
    "physiology_signal_not_sexual_motivation_inference": "ENFORCED",
    "canonical_effect": "NONE"
  }
}
